Sheet: Problem1
A1: i = | B1: 0.08
A2: n = | B2: 8
B4: Year | C4: Cash Flow | D4: Discounted Cash Flow
B5: 0 | C5: -30000 | D5: of:=[.C5]/((1+0.08)^[.B5]) -> -30000
B6: 1 | C6: 1000 | D6: of:=[.C6]/((1+0.08)^[.B6]) -> 925.925925925926
B7: 2 | C7: 1000 | D7: of:=[.C7]/((1+0.08)^[.B7]) -> 857.338820301783
B8: 3 | C8: 1000 | D8: of:=[.C8]/((1+0.08)^[.B8]) -> 793.83224102017
B9: 4 | C9: 1000 | D9: of:=[.C9]/((1+0.08)^[.B9]) -> 735.029852796453
B10: 5 | C10: 1000 | D10: of:=[.C10]/((1+0.08)^[.B10]) -> 680.583197033753
B11: 6 | C11: 1000 | D11: of:=[.C11]/((1+0.08)^[.B11]) -> 630.169626883105
B12: 7 | C12: 1000 | D12: of:=[.C12]/((1+0.08)^[.B12]) -> 583.490395262134
B13: 8 | C13: of:=35000+1000 -> 36000 | D13: of:=[.C13]/((1+0.08)^[.B13]) -> 19449.6798420711
D15: of:=SUM([.D5:.D13]) -> -5343.95009870555

Sheet: Problem3
B2: Land Cost | C2: 4200000 | E2: Discount Factor (monthly) | F2: of:=PV([.C11];[.C12];-1) -> 90.8194163483016
B3: Building Cost | C3: 3500000
B4: Initial Capital Investment= | C4: of:=[.C2]+[.C3] -> 7700000
B5: Property Tax= | C5: of:=[.C4]*0.03 -> 231000 | E5: present value of salvage | F5: of:=[.C9]/(1+[.C10])^12 -> 1437380.52049418
B6: Annual Maintenance= | C6: of:=640000 -> 640000 | E6: present value of costs | F6: of:=[.C8]*((1+[.C11])^[.C12])-1/((1+[.C11])^[.C12]) -> 790617.760904491
B7: Annual Cost= | C7: of:=[.C5]+[.C6] -> 871000
B8: Average Monthly Cost= | C8: of:=[.C7]/12 -> 72583.3333333333
B9: Salvage Value= | C9: of:=[.C2]+([.C3]*0.4) -> 5600000
B10: Annual Rate of return | C10: 0.12
B11: Monthly Rate of return | C11: of:=[.C10]/12 -> 0.01
B12: nperiods | C12: 240
B13: square footage= | C13: 10000
B16: Minimum Monthly Lease Rental= | C16: of:=([.C4]+[.F6]-[.F5])/[.F2] -> 77662.2172219258
B17: lease per square ft= | C17: of:=[.C16]/[.C13] -> 7.76622172219258
B18: 10% vacancy lease | C18: of:=[.C17]/0.9 -> 8.62913524688064

Sheet: Problem4
A1: PV($)= | B1: -6720
A2: FV($)= | B2: 7000
A3: PMT($)= | B3: of:=7000*0.064*0.25 -> 112
A4: n= | B4: of:=4*5 -> 20
A5: of:=RATE([.B4];[.B3];[.B1];[.B2]) -> 0.0184088677445933

Sheet: Problem 5
B2: Year
B3: 0 | C3: -20000
B4: 1 | C4: 1000
B5: 2 | C5: of:=[.C4]*1.1 -> 1100 | E5: Rate of return | F5: of:=IRR([.C3:.C23]) -> 0.0901985383205358
B6: 3 | C6: of:=[.C5]*1.1 -> 1210
B7: 4 | C7: of:=[.C6]*1.1 -> 1331
B8: 5 | C8: of:=[.C7]*1.1 -> 1464.1
B9: 6 | C9: of:=[.C8]*1.1 -> 1610.51
B10: 7 | C10: of:=[.C9]*1.1 -> 1771.561
B11: 8 | C11: of:=[.C10]*1.1 -> 1948.7171
B12: 9 | C12: of:=[.C11]*1.1 -> 2143.58881
B13: 10 | C13: of:=[.C12]*1.1 -> 2357.947691
B14: 11 | C14: of:=[.C13]*1.1 -> 2593.7424601
B15: 12 | C15: of:=[.C14]*1.1 -> 2853.11670611
B16: 13 | C16: of:=[.C15]*1.1 -> 3138.428376721
B17: 14 | C17: of:=[.C16]*1.1 -> 3452.2712143931
B18: 15 | C18: of:=[.C17]*1.1 -> 3797.49833583241
B19: 16 | C19: of:=[.C18]*1.1 -> 4177.24816941565
B20: 17 | C20: of:=[.C19]*1.1 -> 4594.97298635722
B21: 18 | C21: of:=[.C20]*1.1 -> 5054.47028499294
B22: 19 | C22: of:=[.C21]*1.1 -> 5559.91731349224
B23: 20 | C23: of:=[.C22]*1.1 -> 6115.90904484146

Sheet: Problem 6
A1: Step 1 | S1: Step 2
B3: Alternative A | K3: Alternative B | T3: A | U3: B | V3: C | X3: Incremental vs B
X4: A | Y4: C
B5: Interest Rate | C5: 0 | D5: 0.02 | E5: 0.05 | F5: 0.1 | G5: 0.15 | H5: 0.2 | K5: Interest Rate | L5: 0 | M5: 0.02 | N5: 0.05 | O5: 0.1 | P5: 0.15 | Q5: 0.2 | T5: income/payment
T6: -100 | U6: -150 | V6: 0 | X6: of:=[.T6]-[.U6] -> 50 | Y6: of:=[.V6]-[.U6] -> 150
A7: Year | B7: Income/Payment | C7: Present Value | J7: Year | K7: Income/Payment | L7: Present Value | T7: 30 | U7: 42 | V7: 0 | X7: of:=[.T7]-[.U7] -> -12 | Y7: of:=[.V7]-[.U7] -> -42
A8: 0 | B8: -100 | C8: of:=[.$B8]/(1+[.C$5])^[.$A8] -> -100 | D8: of:=[.$B8]/(1+[.D$5])^[.$A8] -> -100 | E8: of:=[.$B8]/(1+[.E$5])^[.$A8] -> -100 | F8: of:=[.$B8]/(1+[.F$5])^[.$A8] -> -100 | G8: of:=[.$B8]/(1+[.G$5])^[.$A8] -> -100 | H8: of:=[.$B8]/(1+[.H$5])^[.$A8] -> -100 | J8: 0 | K8: -150 | L8: of:=[.$K8]/(1+[.L$5])^[.$A8] -> -150 | M8: of:=[.$K8]/(1+[.M$5])^[.$A8] -> -150 | N8: of:=[.$K8]/(1+[.N$5])^[.$A8] -> -150 | O8: of:=[.$K8]/(1+[.O$5])^[.$A8] -> -150 | P8: of:=[.$K8]/(1+[.P$5])^[.$A8] -> -150 | Q8: of:=[.$K8]/(1+[.Q$5])^[.$A8] -> -150 | T8: of:=[.T7] -> 30 | U8: of:=[.U7] -> 42 | V8: 0 | X8: of:=[.T8]-[.U8] -> -12 | Y8: of:=[.V8]-[.U8] -> -42
A9: 1 | B9: 30 | C9: of:=[.B9]/(1+[.C$5])^[.$A9] -> 30 | D9: of:=[.$B9]/(1+[.D$5])^[.$A9] -> 29.4117647058824 | E9: of:=[.$B9]/(1+[.E$5])^[.$A9] -> 28.5714285714286 | F9: of:=[.$B9]/(1+[.F$5])^[.$A9] -> 27.2727272727273 | G9: of:=[.$B9]/(1+[.G$5])^[.$A9] -> 26.0869565217391 | H9: of:=[.$B9]/(1+[.H$5])^[.$A9] -> 25 | J9: 1 | K9: 42 | L9: of:=[.$K9]/(1+[.L$5])^[.$A9] -> 42 | M9: of:=[.$K9]/(1+[.M$5])^[.$A9] -> 41.1764705882353 | N9: of:=[.$K9]/(1+[.N$5])^[.$A9] -> 40 | O9: of:=[.$K9]/(1+[.O$5])^[.$A9] -> 38.1818181818182 | P9: of:=[.$K9]/(1+[.P$5])^[.$A9] -> 36.5217391304348 | Q9: of:=[.$K9]/(1+[.Q$5])^[.$A9] -> 35 | T9: of:=[.T8] -> 30 | U9: of:=[.U8] -> 42 | V9: 0 | X9: of:=[.T9]-[.U9] -> -12 | Y9: of:=[.V9]-[.U9] -> -42
A10: 2 | B10: of:=[.B9] -> 30 | C10: of:=[.B10]/(1+[.C$5])^[.$A10] -> 30 | D10: of:=[.$B10]/(1+[.D$5])^[.$A10] -> 28.8350634371396 | E10: of:=[.$B10]/(1+[.E$5])^[.$A10] -> 27.2108843537415 | F10: of:=[.$B10]/(1+[.F$5])^[.$A10] -> 24.7933884297521 | G10: of:=[.$B10]/(1+[.G$5])^[.$A10] -> 22.6843100189036 | H10: of:=[.$B10]/(1+[.H$5])^[.$A10] -> 20.8333333333333 | J10: 2 | K10: of:=[.K9] -> 42 | L10: of:=[.$K10]/(1+[.L$5])^[.$A10] -> 42 | M10: of:=[.$K10]/(1+[.M$5])^[.$A10] -> 40.3690888119954 | N10: of:=[.$K10]/(1+[.N$5])^[.$A10] -> 38.0952380952381 | O10: of:=[.$K10]/(1+[.O$5])^[.$A10] -> 34.7107438016529 | P10: of:=[.$K10]/(1+[.P$5])^[.$A10] -> 31.758034026465 | Q10: of:=[.$K10]/(1+[.Q$5])^[.$A10] -> 29.1666666666667 | T10: of:=[.T9] -> 30 | U10: of:=[.U9] -> 42 | V10: 0 | X10: of:=[.T10]-[.U10] -> -12 | Y10: of:=[.V10]-[.U10] -> -42
A11: 3 | B11: of:=[.B10] -> 30 | C11: of:=[.B11]/(1+[.C$5])^[.$A11] -> 30 | D11: of:=[.$B11]/(1+[.D$5])^[.$A11] -> 28.2696700364113 | E11: of:=[.$B11]/(1+[.E$5])^[.$A11] -> 25.9151279559443 | F11: of:=[.$B11]/(1+[.F$5])^[.$A11] -> 22.5394440270473 | G11: of:=[.$B11]/(1+[.G$5])^[.$A11] -> 19.7254869729596 | H11: of:=[.$B11]/(1+[.H$5])^[.$A11] -> 17.3611111111111 | J11: 3 | K11: of:=[.K10] -> 42 | L11: of:=[.$K11]/(1+[.L$5])^[.$A11] -> 42 | M11: of:=[.$K11]/(1+[.M$5])^[.$A11] -> 39.5775380509759 | N11: of:=[.$K11]/(1+[.N$5])^[.$A11] -> 36.281179138322 | O11: of:=[.$K11]/(1+[.O$5])^[.$A11] -> 31.5552216378663 | P11: of:=[.$K11]/(1+[.P$5])^[.$A11] -> 27.6156817621435 | Q11: of:=[.$K11]/(1+[.Q$5])^[.$A11] -> 24.3055555555556 | T11: of:=[.T10] -> 30 | U11: of:=[.U10] -> 42 | V11: 0 | X11: of:=[.T11]-[.U11] -> -12 | Y11: of:=[.V11]-[.U11] -> -42
A12: 4 | B12: of:=[.B11] -> 30 | C12: of:=[.B12]/(1+[.C$5])^[.$A12] -> 30 | D12: of:=[.$B12]/(1+[.D$5])^[.$A12] -> 27.7153627807954 | E12: of:=[.$B12]/(1+[.E$5])^[.$A12] -> 24.6810742437565 | F12: of:=[.$B12]/(1+[.F$5])^[.$A12] -> 20.4904036609521 | G12: of:=[.$B12]/(1+[.G$5])^[.$A12] -> 17.152597367791 | H12: of:=[.$B12]/(1+[.H$5])^[.$A12] -> 14.4675925925926 | J12: 4 | K12: of:=[.K11] -> 42 | L12: of:=[.$K12]/(1+[.L$5])^[.$A12] -> 42 | M12: of:=[.$K12]/(1+[.M$5])^[.$A12] -> 38.8015078931136 | N12: of:=[.$K12]/(1+[.N$5])^[.$A12] -> 34.553503941259 | O12: of:=[.$K12]/(1+[.O$5])^[.$A12] -> 28.686565125333 | P12: of:=[.$K12]/(1+[.P$5])^[.$A12] -> 24.0136363149074 | Q12: of:=[.$K12]/(1+[.Q$5])^[.$A12] -> 20.2546296296296
A13: 5 | B13: of:=[.B12] -> 30 | C13: of:=[.B13]/(1+[.C$5])^[.$A13] -> 30 | D13: of:=[.$B13]/(1+[.D$5])^[.$A13] -> 27.1719242948975 | E13: of:=[.$B13]/(1+[.E$5])^[.$A13] -> 23.5057849940538 | F13: of:=[.$B13]/(1+[.F$5])^[.$A13] -> 18.6276396917747 | G13: of:=[.$B13]/(1+[.G$5])^[.$A13] -> 14.9153020589487 | H13: of:=[.$B13]/(1+[.H$5])^[.$A13] -> 12.0563271604938 | J13: 5 | K13: of:=[.K12] -> 42 | L13: of:=[.$K13]/(1+[.L$5])^[.$A13] -> 42 | M13: of:=[.$K13]/(1+[.M$5])^[.$A13] -> 38.0406940128565 | N13: of:=[.$K13]/(1+[.N$5])^[.$A13] -> 32.9080989916753 | O13: of:=[.$K13]/(1+[.O$5])^[.$A13] -> 26.0786955684845 | P13: of:=[.$K13]/(1+[.P$5])^[.$A13] -> 20.8814228825282 | Q13: of:=[.$K13]/(1+[.Q$5])^[.$A13] -> 16.8788580246914 | S13: IRR: | T13: of:=IRR([.T6:.T11]) -> 0.152382371166306 | U13: of:=IRR([.U6:.U11]) -> 0.123762414568676 | X13: of:=IRR([.X6:.X11]) -> 0.0640224076431011 | Y13: of:=IRR([.Y6:.Y11]) -> 0.123762414568676
B15: Net Present Value | C15: of:=SUM([.C8:.C13]) -> 50 | D15: of:=SUM([.D8:.D13]) -> 41.4037852551262 | E15: of:=SUM([.E8:.E13]) -> 29.8843001189246 | F15: of:=SUM([.F8:.F13]) -> 13.7236030822534 | G15: of:=SUM([.G8:.G13]) -> 0.564652940342072 | H15: of:=SUM([.H8:.H13]) -> -10.2816358024691 | K15: Net Present Value | L15: of:=SUM([.L8:.L13]) -> 60 | M15: of:=SUM([.M8:.M13]) -> 47.9652993571766 | N15: of:=SUM([.N8:.N13]) -> 31.8380201664944 | O15: of:=SUM([.O8:.O13]) -> 9.2130443151548 | P15: of:=SUM([.P8:.P13]) -> -9.2094858835211 | Q15: of:=SUM([.Q8:.Q13]) -> -24.3942901234568
A16: IRR | B16: of:=IRR([.B8:.B13]) -> 0.152382371166306 | J16: IRR | K16: of:=IRR([.K8:.K13]) -> 0.123762414568676
T19: Choice Table:
S20: If | T20: 0 | U20: < borrowing rate <= | V20: 6.4 | W20: Select B
S21: If | T21: 6.4 | U21: < borrowing rate <= | V21: 15.24 | W21: Select A
S22: If | T22: 15.24 | U22: < borrowing rate <= | W22: Do nothing

Sheet: Problem7
B2: Year | C2: Gas Station CF | D2: Ice Cream CF | F2: Ice Cream vs Gas station
B3: 0 | C3: -80000 | D3: -120000 | F3: of:=[.D3]-[.C3] -> -40000
B4: 1 | C4: of:=11000-3000 -> 8000 | D4: of:=16000-5000 -> 11000 | F4: of:=[.D4]-[.C4] -> 3000
B5: 2 | C5: of:=11000-3000 -> 8000 | D5: of:=16000-5000 -> 11000 | F5: of:=[.D5]-[.C5] -> 3000
B6: 3 | C6: of:=11000-3000 -> 8000 | D6: of:=16000-5000 -> 11000 | F6: of:=[.D6]-[.C6] -> 3000
B7: 4 | C7: of:=11000-3000 -> 8000 | D7: of:=16000-5000 -> 11000 | F7: of:=[.D7]-[.C7] -> 3000
B8: 5 | C8: of:=11000-3000 -> 8000 | D8: of:=16000-5000 -> 11000 | F8: of:=[.D8]-[.C8] -> 3000
B9: 6 | C9: of:=11000-3000 -> 8000 | D9: of:=16000-5000 -> 11000 | F9: of:=[.D9]-[.C9] -> 3000
B10: 7 | C10: of:=11000-3000 -> 8000 | D10: of:=16000-5000 -> 11000 | F10: of:=[.D10]-[.C10] -> 3000
B11: 8 | C11: of:=11000-3000 -> 8000 | D11: of:=16000-5000 -> 11000 | F11: of:=[.D11]-[.C11] -> 3000
B12: 9 | C12: of:=11000-3000 -> 8000 | D12: of:=16000-5000 -> 11000 | F12: of:=[.D12]-[.C12] -> 3000
B13: 10 | C13: of:=11000-3000 -> 8000 | D13: of:=16000-5000 -> 11000 | F13: of:=[.D13]-[.C13] -> 3000
B14: 11 | C14: of:=11000-3000 -> 8000 | D14: of:=16000-5000 -> 11000 | F14: of:=[.D14]-[.C14] -> 3000
B15: 12 | C15: of:=11000-3000 -> 8000 | D15: of:=16000-5000 -> 11000 | F15: of:=[.D15]-[.C15] -> 3000
B16: 13 | C16: of:=11000-3000 -> 8000 | D16: of:=16000-5000 -> 11000 | F16: of:=[.D16]-[.C16] -> 3000
B17: 14 | C17: of:=11000-3000 -> 8000 | D17: of:=16000-5000 -> 11000 | F17: of:=[.D17]-[.C17] -> 3000
B18: 15 | C18: of:=11000-3000 -> 8000 | D18: of:=16000-5000 -> 11000 | F18: of:=[.D18]-[.C18] -> 3000
B19: 16 | C19: of:=11000-3000 -> 8000 | D19: of:=16000-5000 -> 11000 | F19: of:=[.D19]-[.C19] -> 3000
B20: 17 | C20: of:=11000-3000 -> 8000 | D20: of:=16000-5000 -> 11000 | F20: of:=[.D20]-[.C20] -> 3000
B21: 18 | C21: of:=11000-3000 -> 8000 | D21: of:=16000-5000 -> 11000 | F21: of:=[.D21]-[.C21] -> 3000
B22: 19 | C22: of:=11000-3000 -> 8000 | D22: of:=16000-5000 -> 11000 | F22: of:=[.D22]-[.C22] -> 3000
B23: 20 | C23: of:=11000-3000 -> 8000 | D23: of:=16000-5000 -> 11000 | F23: of:=[.D23]-[.C23] -> 3000
E25: IRR= | F25: of:=IRR([.F2:.F23]) -> 0.0421661103915819